{
  "$schema": "https://mcp-codegen.dev/schemas/atm/v1.json",
  "specVersion": "1.0.0",
  "codeMode": true,
  "name": "mcp-codegen-demo",
  "description": "Universal tool wrappers for MCP filesystem and demo REST API",
  "version": "1.1.0",
  "generated": "2025-11-28T00:00:00.000Z",
  "language": "typescript",
  "sources": {
    "mcp": ["filesystem"],
    "openapi": ["demoapi"],
    "total": 2
  },
  "tools": {
    "total": 19,
    "bySource": {
      "filesystem": 14,
      "demoapi": 5
    }
  },
  "paths": {
    "runtime": "./codegen/runtime",
    "wrappers": "./codegen",
    "config": "./codegen.config.json"
  },
  "capabilities": [
    "type-safety",
    "mcp-servers",
    "rest-apis",
    "connection-pooling",
    "retry-policy",
    "authentication"
  ],
  "auth": {
    "required": false,
    "sources": {
      "filesystem": {
        "types": ["none"],
        "required": false
      },
      "demoapi": {
        "types": ["none", "bearer"],
        "default": "none",
        "required": false
      }
    }
  },
  "tokenReduction": {
    "traditional": 2442,
    "codeMode": 139,
    "reduction": 0.9431,
    "savings": "94.3%"
  },
  "metadata": {
    "generatedBy": "mcp-codegen@1.1.0",
    "homepage": "https://github.com/tyranosurasmax/MCP-CODEGEN"
  }
}
